[
  {
    "id": "w_dag",
    "lemma": "dag",
    "pos": "tw",
    "zh": "你好；再见（打招呼用）",
    "en": "hello; bye"
  },
  {
    "id": "w_ik",
    "lemma": "ik",
    "pos": "vnw",
    "zh": "我",
    "en": "I"
  },
  {
    "id": "w_jij",
    "lemma": "jij",
    "pos": "vnw",
    "forms_seen": ["je"],
    "zh": "你",
    "en": "you (informal)"
  },
  {
    "id": "w_u",
    "lemma": "u",
    "pos": "vnw",
    "zh": "您",
    "en": "you (polite)"
  },
  {
    "id": "w_zijn",
    "lemma": "zijn",
    "pos": "ww",
    "verb_forms": {
      "ik": "ben",
      "jij": "bent",
      "hij": "is",
      "wij": "zijn",
      "pp": "geweest",
      "aux": "zijn"
    },
    "zh": "是",
    "en": "to be"
  },
  {
    "id": "w_en",
    "lemma": "en",
    "pos": "vw",
    "zh": "和；那么",
    "en": "and"
  },
  {
    "id": "w_dank_je",
    "lemma": "dank je",
    "pos": "uitdr",
    "zh": "谢谢（对熟人）",
    "en": "thank you (informal)"
  },
  {
    "id": "w_wat",
    "lemma": "wat",
    "pos": "vnw",
    "zh": "什么",
    "en": "what"
  },
  {
    "id": "w_dat",
    "lemma": "dat",
    "pos": "vnw",
    "zh": "那，那个",
    "en": "that"
  },
  {
    "id": "w_een",
    "lemma": "een",
    "pos": "lidw",
    "zh": "一个（不定冠词）",
    "en": "a, an"
  },
  {
    "id": "w_kam",
    "lemma": "kam",
    "pos": "zn",
    "article": "de",
    "plural": "kammen",
    "zh": "梳子",
    "en": "comb"
  },
  {
    "id": "w_bal",
    "lemma": "bal",
    "pos": "zn",
    "article": "de",
    "plural": "ballen",
    "zh": "球",
    "en": "ball"
  },
  {
    "id": "w_man",
    "lemma": "man",
    "pos": "zn",
    "article": "de",
    "plural": "mannen",
    "zh": "男人",
    "en": "man"
  },
  {
    "id": "w_mes",
    "lemma": "mes",
    "pos": "zn",
    "article": "het",
    "plural": "messen",
    "zh": "刀",
    "en": "knife"
  },
  {
    "id": "w_bel",
    "lemma": "bel",
    "pos": "zn",
    "article": "de",
    "plural": "bellen",
    "zh": "铃，门铃",
    "en": "bell, doorbell"
  },
  {
    "id": "w_pen",
    "lemma": "pen",
    "pos": "zn",
    "article": "de",
    "plural": "pennen",
    "zh": "笔",
    "en": "pen"
  },
  {
    "id": "w_kip",
    "lemma": "kip",
    "pos": "zn",
    "article": "de",
    "plural": "kippen",
    "zh": "鸡",
    "en": "chicken"
  },
  {
    "id": "w_lip",
    "lemma": "lip",
    "pos": "zn",
    "article": "de",
    "plural": "lippen",
    "zh": "嘴唇",
    "en": "lip"
  },
  {
    "id": "w_anna",
    "lemma": "Anna",
    "pos": "eigen",
    "zh": "安娜（人名）",
    "en": "Anna (name)"
  },
  {
    "id": "w_sam",
    "lemma": "Sam",
    "pos": "eigen",
    "zh": "萨姆（人名）",
    "en": "Sam (name)"
  },
  {
    "id": "w_uw",
    "lemma": "uw",
    "pos": "vnw",
    "zh": "您的",
    "en": "your (polite)"
  },
  {
    "id": "w_mijn",
    "lemma": "mijn",
    "pos": "vnw",
    "zh": "我的",
    "en": "my"
  },
  {
    "id": "w_naam",
    "lemma": "naam",
    "pos": "zn",
    "article": "de",
    "plural": "namen",
    "zh": "名字",
    "en": "name"
  },
  {
    "id": "w_maan",
    "lemma": "maan",
    "pos": "zn",
    "article": "de",
    "plural": "manen",
    "zh": "月亮",
    "en": "moon"
  },
  {
    "id": "w_taal",
    "lemma": "taal",
    "pos": "zn",
    "article": "de",
    "plural": "talen",
    "zh": "语言",
    "en": "language"
  },
  {
    "id": "w_ja",
    "lemma": "ja",
    "pos": "tw",
    "zh": "是，对",
    "en": "yes"
  },
  {
    "id": "w_nee",
    "lemma": "nee",
    "pos": "tw",
    "zh": "不，不是",
    "en": "no"
  },
  {
    "id": "w_twee",
    "lemma": "twee",
    "pos": "telw",
    "zh": "二，两个",
    "en": "two"
  },
  {
    "id": "w_thee",
    "lemma": "thee",
    "pos": "zn",
    "article": "de",
    "plural": null,
    "zh": "茶",
    "en": "tea"
  },
  {
    "id": "w_graag",
    "lemma": "graag",
    "pos": "bw",
    "zh": "乐意；（点东西时）劳驾",
    "en": "gladly; please (when ordering)"
  },
  {
    "id": "w_leren",
    "lemma": "leren",
    "pos": "ww",
    "verb_forms": {
      "ik": "leer",
      "jij": "leert",
      "hij": "leert",
      "wij": "leren",
      "pp": "geleerd",
      "aux": "hebben"
    },
    "zh": "学，学习",
    "en": "to learn"
  },
  {
    "id": "w_nederlands",
    "lemma": "Nederlands",
    "pos": "zn",
    "article": "het",
    "plural": null,
    "zh": "荷兰语",
    "en": "Dutch (language)"
  },
  {
    "id": "w_de",
    "lemma": "de",
    "pos": "lidw",
    "zh": "（定冠词，用于 de 词）",
    "en": "the"
  },
  {
    "id": "w_het",
    "lemma": "het",
    "pos": "lidw",
    "zh": "（定冠词，用于 het 词）；它",
    "en": "the; it"
  },
  {
    "id": "w_in",
    "lemma": "in",
    "pos": "vz",
    "zh": "在……里",
    "en": "in"
  },
  {
    "id": "w_niet",
    "lemma": "niet",
    "pos": "bw",
    "zh": "不",
    "en": "not"
  },
  {
    "id": "w_waar",
    "lemma": "waar",
    "pos": "bw",
    "zh": "哪里",
    "en": "where"
  },
  {
    "id": "w_hier",
    "lemma": "hier",
    "pos": "bw",
    "zh": "这里",
    "en": "here"
  },
  {
    "id": "w_al",
    "lemma": "al",
    "pos": "bw",
    "zh": "已经",
    "en": "already"
  },
  {
    "id": "w_of",
    "lemma": "of",
    "pos": "vw",
    "zh": "或者；还是",
    "en": "or"
  },
  {
    "id": "w_met",
    "lemma": "met",
    "pos": "vz",
    "zh": "和……一起；用",
    "en": "with"
  },
  {
    "id": "w_jou",
    "lemma": "jou",
    "pos": "vnw",
    "zh": "你（宾格）",
    "en": "you (object, informal)"
  },
  {
    "id": "w_geen",
    "lemma": "geen",
    "pos": "vnw",
    "zh": "没有；不是（一个）",
    "en": "no, not a"
  },
  {
    "id": "w_naar",
    "lemma": "naar",
    "pos": "vz",
    "zh": "去，往",
    "en": "to (a place)"
  },
  {
    "id": "w_waarom",
    "lemma": "waarom",
    "pos": "bw",
    "zh": "为什么",
    "en": "why"
  },
  {
    "id": "w_hij",
    "lemma": "hij",
    "pos": "vnw",
    "zh": "他",
    "en": "he"
  },
  {
    "id": "w_mij",
    "lemma": "mij",
    "pos": "vnw",
    "zh": "我（宾格）",
    "en": "me"
  },
  {
    "id": "w_om",
    "lemma": "om",
    "pos": "vz",
    "zh": "在（几点）",
    "en": "at (a time)"
  },
  {
    "id": "w_nog",
    "lemma": "nog",
    "pos": "bw",
    "zh": "还；再",
    "en": "still; more, again"
  },
  {
    "id": "w_over",
    "lemma": "over",
    "pos": "vz",
    "zh": "过（几点几分）；关于",
    "en": "past (the hour); about"
  },
  {
    "id": "w_hoe",
    "lemma": "hoe",
    "pos": "bw",
    "zh": "怎么，怎样",
    "en": "how"
  },
  {
    "id": "w_welk",
    "lemma": "welk",
    "pos": "vnw",
    "zh": "哪个，哪些",
    "en": "which",
    "forms_seen": ["welke"]
  },
  {
    "id": "w_hebben",
    "lemma": "hebben",
    "pos": "ww",
    "verb_forms": {
      "ik": "heb",
      "jij": "hebt",
      "hij": "heeft",
      "wij": "hebben",
      "pp": "gehad",
      "aux": "hebben"
    },
    "forms_seen": ["heeft"],
    "zh": "有",
    "en": "to have"
  },
  {
    "id": "w_gaan",
    "lemma": "gaan",
    "pos": "ww",
    "verb_forms": {
      "ik": "ga",
      "jij": "gaat",
      "hij": "gaat",
      "wij": "gaan",
      "pp": "gegaan",
      "aux": "zijn"
    },
    "zh": "去",
    "en": "to go"
  },
  {
    "id": "w_kunnen",
    "lemma": "kunnen",
    "pos": "ww",
    "verb_forms": {
      "ik": "kan",
      "jij": "kunt",
      "hij": "kan",
      "wij": "kunnen",
      "pp": "gekund",
      "aux": "hebben"
    },
    "forms_seen": ["kun"],
    "zh": "能，会，可以",
    "en": "can, to be able to"
  },
  {
    "id": "w_kop",
    "lemma": "kop",
    "pos": "zn",
    "article": "de",
    "plural": "koppen",
    "zh": "杯子（带把的）",
    "en": "cup"
  },
  {
    "id": "w_sok",
    "lemma": "sok",
    "pos": "zn",
    "article": "de",
    "plural": "sokken",
    "zh": "袜子",
    "en": "sock"
  },
  {
    "id": "w_pot",
    "lemma": "pot",
    "pos": "zn",
    "article": "de",
    "plural": "potten",
    "zh": "罐子；锅",
    "en": "pot, jar"
  },
  {
    "id": "w_mug",
    "lemma": "mug",
    "pos": "zn",
    "article": "de",
    "plural": "muggen",
    "zh": "蚊子",
    "en": "mosquito"
  },
  {
    "id": "w_bus",
    "lemma": "bus",
    "pos": "zn",
    "article": "de",
    "plural": "bussen",
    "zh": "公交车",
    "en": "bus"
  },
  {
    "id": "w_tas",
    "lemma": "tas",
    "pos": "zn",
    "article": "de",
    "plural": "tassen",
    "zh": "包，袋子",
    "en": "bag"
  },
  {
    "id": "w_druk",
    "lemma": "druk",
    "pos": "bn",
    "zh": "忙的；人多的，拥挤的",
    "en": "busy, crowded"
  },
  {
    "id": "w_vol",
    "lemma": "vol",
    "pos": "bn",
    "zh": "满的",
    "en": "full"
  },
  {
    "id": "w_pas_op",
    "lemma": "pas op",
    "pos": "uitdr",
    "zh": "小心！",
    "en": "watch out!"
  },
  {
    "id": "w_noot",
    "lemma": "noot",
    "pos": "zn",
    "article": "de",
    "plural": "noten",
    "zh": "坚果",
    "en": "nut"
  },
  {
    "id": "w_rood",
    "lemma": "rood",
    "pos": "bn",
    "zh": "红色的",
    "en": "red"
  },
  {
    "id": "w_zoon",
    "lemma": "zoon",
    "pos": "zn",
    "article": "de",
    "plural": "zonen",
    "zh": "儿子",
    "en": "son"
  },
  {
    "id": "w_vuur",
    "lemma": "vuur",
    "pos": "zn",
    "article": "het",
    "plural": "vuren",
    "zh": "火",
    "en": "fire"
  },
  {
    "id": "w_uur",
    "lemma": "uur",
    "pos": "zn",
    "article": "het",
    "plural": "uren",
    "zh": "小时；……点钟",
    "en": "hour; o'clock"
  },
  {
    "id": "w_duur",
    "lemma": "duur",
    "pos": "bn",
    "zh": "贵的",
    "en": "expensive"
  },
  {
    "id": "w_jaar",
    "lemma": "jaar",
    "pos": "zn",
    "article": "het",
    "plural": "jaren",
    "zh": "年；岁",
    "en": "year"
  },
  {
    "id": "w_zeep",
    "lemma": "zeep",
    "pos": "zn",
    "article": "de",
    "plural": "zepen",
    "zh": "肥皂",
    "en": "soap"
  },
  {
    "id": "w_geel",
    "lemma": "geel",
    "pos": "bn",
    "zh": "黄色的",
    "en": "yellow"
  },
  {
    "id": "w_wonen",
    "lemma": "wonen",
    "pos": "ww",
    "verb_forms": {
      "ik": "woon",
      "jij": "woont",
      "hij": "woont",
      "wij": "wonen",
      "pp": "gewoond",
      "aux": "hebben"
    },
    "zh": "住，居住",
    "en": "to live, to reside"
  },
  {
    "id": "w_voet",
    "lemma": "voet",
    "pos": "zn",
    "article": "de",